{
  "$schema": "./component-roadmap.schema.json",
  "verifiedAgainst": {
    "repository": "https://github.com/shadcn-ui/ui",
    "commit": "71e50952fbb7eda2c992660d36cd58671a2edf42",
    "date": "2026-09-02"
  },
  "documentation": {
    "complete": ["all 65 registry components"],
    "next": []
  },
  "classifications": {
    "full": "all shared components not listed as adapted",
    "adapted": [
      "carousel",
      "chart",
      "command",
      "context-menu",
      "menubar",
      "navigation-menu",
      "resizable",
      "scroll-area",
      "slider",
      "tooltip"
    ],
    "recipe": ["data-table", "date-picker", "typography"],
    "legacy": []
  },
  "qualityContract": {
    "statuses": [
      "verified",
      "partial",
      "adapted",
      "unverified",
      "not-applicable"
    ],
    "dimensions": [
      "visual",
      "behavior",
      "accessibility",
      "composition",
      "documentation",
      "registry"
    ],
    "defaults": {
      "visual": "unverified",
      "behavior": "partial",
      "accessibility": "partial",
      "composition": "partial",
      "documentation": "verified",
      "registry": "verified"
    },
    "classificationOverrides": {
      "adapted": { "behavior": "adapted", "composition": "adapted" },
      "recipe": { "composition": "adapted" },
      "legacy": { "behavior": "adapted", "composition": "adapted" }
    },
    "componentOverrides": {
      "button": { "accessibility": "verified" },
      "dialog": {
        "behavior": "verified",
        "accessibility": "verified",
        "composition": "verified"
      },
      "input": { "accessibility": "verified" },
      "select": { "behavior": "verified", "accessibility": "verified" },
      "sheet": { "composition": "verified" }
    },
    "evidence": {
      "button": ["e2e/site.spec.ts#flagship-accessibility"],
      "dialog": [
        "e2e/site.spec.ts#dialog-focus-and-compound-parts",
        "e2e/site.spec.ts#flagship-accessibility"
      ],
      "input": ["e2e/site.spec.ts#flagship-accessibility"],
      "select": ["e2e/site.spec.ts#flagship-accessibility"],
      "sheet": ["e2e/site.spec.ts#sheet-compound-parts"]
    }
  },
  "fidelity": [
    {
      "component": "carousel",
      "priority": "P1",
      "gap": "Add browser contracts for keyboard navigation, loop boundaries, multi-slide stepping, and focus retention."
    },
    {
      "component": "chart",
      "priority": "P1",
      "gap": "Add visual regression coverage for token resolution, responsive resize, tooltip content, and dark mode."
    },
    {
      "component": "command",
      "priority": "P1",
      "gap": "Add browser contracts for filtering, grouped results, empty state, active descendant, and selection."
    },
    {
      "component": "context-menu",
      "priority": "P1",
      "gap": "Add pointer-coordinate, keyboard fallback, focus return, submenu, and viewport-collision browser contracts."
    },
    {
      "component": "menubar",
      "priority": "P1",
      "gap": "Add browser contracts for left/right wrapping, submenu navigation, Escape, and focus restoration."
    },
    {
      "component": "navigation-menu",
      "priority": "P2",
      "gap": "Add browser contracts for disclosure semantics, keyboard traversal, focus restoration, and responsive layout."
    },
    {
      "component": "resizable",
      "priority": "P1",
      "gap": "Add pointer and keyboard resizing contracts with minimum-size and total-width invariants."
    },
    {
      "component": "scroll-area",
      "priority": "P2",
      "gap": "Add cross-browser keyboard and high-contrast coverage for native scrollbars."
    },
    {
      "component": "slider",
      "priority": "P1",
      "gap": "Add browser contracts for keyboard steps, range thumb constraints, orientation, and ARIA values."
    },
    {
      "component": "tooltip",
      "priority": "P1",
      "gap": "Add hover, focus, touch dismissal, delay cancellation, collision, and accessible-description contracts."
    }
  ],
  "intentionalDifferences": [
    {
      "component": "chart",
      "reason": "Uses framework-native SVG and ECharts adapters rather than the React-only Recharts composition engine."
    },
    {
      "component": "carousel",
      "reason": "Uses a controlled Foldkit model rather than Embla's plugin API."
    },
    {
      "component": "context-menu",
      "reason": "Captures cursor coordinates from secondary pointer-down because Foldkit OnContextMenu carries only a Message."
    },
    {
      "component": "resizable",
      "reason": "Receives the measured group extent explicitly because pure Foldkit pointer Messages do not expose currentTarget bounds."
    },
    {
      "component": "scroll-area",
      "reason": "Uses accessible native scrollbars rather than decorative custom scrollbar parts."
    }
  ],
  "missing": []
}
